A1: Training | C1: Testing
C2: 2012 | D2: 2013 | E2: 2014 | F2: 2015 | G2: 2016 | H2: 2017 | I2: 2018
A3: 2011 | B3: Degree | C3: 85.23 | D3: 83.07 | E3: 74.37 | F3: 19.23 | G3: 19.11 | H3: 28.51 | I3: 24.43
B4: Closeness | C4: 82.93 | D4: 73.83 | E4: 68.959999999999994 | F4: 26.05 | G4: 32.58 | H4: 24.87 | I4: 27.36
B5: Harmonic | C5: 89.73 | D5: 86.32 | E5: 76.540000000000006 | F5: 30.31 | G5: 34.869999999999997 | H5: 21.95 | I5: 16.16
B6: Katz | C6: 86.25 | D6: 79.430000000000007 | E6: 76.66 | F6: 38.270000000000003 | G6: 28.03 | H6: 13.87 | I6: 9.08
B7: Average | C7: 89.80 | D7: 86.70 | E7: 76.77 | F7: 29.64 | G7: 34.200000000000003 | H7: 21.37 | I7: 16.09
B8: CenDroid_AVE | C8: =AVERAGE(C3,C7) -> 87.515 | D8: =AVERAGE(D3,D7) -> 84.885 | E8: =AVERAGE(E3,E7) -> 75.569999999999993 | F8: =AVERAGE(F3,F7) -> 24.435 | G8: =AVERAGE(G3,G7) -> 26.655 | H8: =AVERAGE(H3,H7) -> 24.94 | I8: =AVERAGE(I3,I7) -> 20.259999999999998
B9: CenDroid_MAX | C9: =MAX(C3:C7) -> 89.80 | D9: =MAX(D3:D7) -> 86.70 | E9: =MAX(E3:E7) -> 76.77 | F9: =MAX(F3:F7) -> 38.270000000000003 | G9: =MAX(G3:G7) -> 34.869999999999997 | H9: =MAX(H3:H7) -> 28.51 | I9: =MAX(I3:I7) -> 27.36
B10: MaMaDroid | C10: 81.94 | D10: 78.680000000000007 | E10: 71.900000000000006 | F10: 54.58 | G10: 50.28 | H10: 36.58 | I10: 17.23
B11: Drebin | C11: 84.37 | D11: 80.37 | E11: 81.64 | F11: 38.380000000000003 | G11: 37.40 | H11: 35.33 | I11: 35.46
A12: 1112 | B12: Degree | D12: 84.39 | E12: 76.66 | F12: 65.97 | G12: 56.41 | H12: 16.47 | I12: 13.55
B13: Closeness | D13: 88.67 | E13: 80.19 | F13: 68.47 | G13: 58.09 | H13: 30.98 | I13: 24.31
B14: Harmonic | D14: 89.67 | E14: 79.55 | F14: 64.17 | G14: 62.19 | H14: 43.76 | I14: 26.30
B15: Katz | D15: 85.49 | E15: 77.23 | F15: 72.180000000000007 | G15: 58.35 | H15: 23.70 | I15: 17.61
B16: Average | D16: 89.65 | E16: 79.55 | F16: 70.62 | G16: 64.849999999999994 | H16: 43.21 | I16: 26.29
B17: CenDroid_AVE | D17: =AVERAGE(D12:D16) -> 87.573999999999998 | E17: =AVERAGE(E12:E16) -> 78.635999999999996 | F17: =AVERAGE(F12:F16) -> 68.282000000000011 | G17: =AVERAGE(G12:G16) -> 59.977999999999994 | H17: =AVERAGE(H12:H16) -> 31.624000000000002 | I17: =AVERAGE(I12:I16) -> 21.612000000000002
B18: CenDroid_MAX | D18: =MAX(D12:D16) -> 89.67 | E18: =MAX(E12:E16) -> 80.19 | F18: =MAX(F12:F16) -> 72.180000000000007 | G18: =MAX(G12:G16) -> 64.849999999999994 | H18: =MAX(H12:H16) -> 43.76 | I18: =MAX(I12:I16) -> 26.30
B19: MaMaDroid | D19: 87.43 | E19: 78.39 | F19: 65.06 | G19: 66.489999999999995 | H19: 54.32 | I19: 40.39
B20: Drebin | D20: 91.02 | E20: 82.65 | F20: 77.62 | G20: 77.86 | H20: 50.94 | I20: 40.90
A21: 111213 | B21: Degree | E21: 86.94 | F21: 53.04 | G21: 46.32 | H21: 13.49 | I21: 13.73
B22: Closeness | E22: 86.32 | F22: 38.159999999999997 | G22: 44.29 | H22: 29.79 | I22: 25.60
B23: Harmonic | E23: 90.86 | F23: 51.57 | G23: 46.23 | H23: 41.37 | I23: 22.03
B24: Katz | E24: 84.95 | F24: 48.83 | G24: 51.27 | H24: 26.29 | I24: 22.03
B25: Average | E25: 90.86 | F25: 40.28 | G25: 41.29 | H25: 41.37 | I25: 22.02
B26: CenDroid_AVE | E26: =AVERAGE(E21:E25) -> 87.986000000000004 | F26: =AVERAGE(F21:F25) -> 46.375999999999991 | G26: =AVERAGE(G21:G25) -> 45.88 | H26: =AVERAGE(H21:H25) -> 30.462 | I26: =AVERAGE(I21:I25) -> 21.082000000000001
B27: CenDroid_MAX | E27: =MAX(E21:E25) -> 90.86 | F27: =MAX(F21:F25) -> 53.04 | G27: =MAX(G21:G25) -> 51.27 | H27: =MAX(H21:H25) -> 41.37 | I27: =MAX(I21:I25) -> 25.60
B28: MaMaDroid | E28: 86.04 | F28: 71.52 | G28: 70.599999999999994 | H28: 50.97 | I28: 22.52
B29: Drebin | E29: 91.16 | F29: 61.52 | G29: 62.36 | H29: 43.68 | I29: 38.06
A30: 11121314 | B30: Degree | F30: 71.569999999999993 | G30: 58.53 | H30: 41.36 | I30: 55.82
B31: Closeness | F31: 65.290000000000006 | G31: 59.73 | H31: 34.21 | I31: 34.21
B32: Harmonic | F32: 74.489999999999995 | G32: 67.900000000000006 | H32: 62.45 | I32: 60.04
B33: Katz | F33: 73.040000000000006 | G33: 57.11 | H33: 25.59 | I33: 19.02
B34: Average | F34: 76.22 | G34: 70.81 | H34: 64.38 | I34: 61.03
B35: CenDroid_AVE | F35: =AVERAGE(F30:F34) -> 72.122 | G35: =AVERAGE(G30:G34) -> 62.815999999999995 | H35: =AVERAGE(H30:H34) -> 45.597999999999999 | I35: =AVERAGE(I30:I34) -> 46.024000000000001
B36: CenDroid_MAX | F36: =MAX(F30:F34) -> 76.22 | G36: =MAX(G30:G34) -> 70.81 | H36: =MAX(H30:H34) -> 64.38 | I36: =MAX(I30:I34) -> 61.03
B37: MaMaDroid | F37: 81.77 | G37: 74.459999999999994 | H37: 64.12 | I37: 57.20
B38: Drebin | F38: 62.15 | G38: 62.36 | H38: 42.61 | I38: 37.79